{
  "$schema": "./source.schema.json",
  "schemaVersion": 1,
  "kind": "text-to-ui-resource-sources",
  "documents": [
    {
      "path": "references/requirement-spec.md",
      "policy": "generated-compatibility-aggregate",
      "parts": [
        "requirements.overview",
        "requirements.contents",
        "requirements.intake-principle",
        "requirements.three-decision-layers",
        "requirements.adaptive-question-policy",
        "requirements.user-input-guidance",
        "requirements.first-preview-planning",
        "requirements.generated-requirement-contract",
        "requirements.fixed-harmonyos-defaults-from-native-references",
        "requirements.anti-patterns"
      ],
      "baselineSha256": "b9960810610843f0802070264545b0ebf14b2ce21949bb7fbcc19b44e72451b1",
      "baselineBytes": 13930
    },
    {
      "path": "references/layout-system.md",
      "policy": "generated-compatibility-aggregate",
      "parts": [
        "layout.overview",
        "layout.window-foundation",
        "layout.application-shell",
        "layout.page-spacing",
        "layout.grid",
        "layout.resize-rules",
        "layout.html-mapping",
        "layout.decisions-to-confirm"
      ],
      "baselineSha256": "1b63fe82134fcdc2e36a4b72edc41aa2d08908f700f84d705d6e2452089c6a9e",
      "baselineBytes": 20610
    },
    {
      "path": "references/harmonyos-layout-patterns.md",
      "policy": "generated-compatibility-aggregate",
      "parts": [
        "patterns.overview",
        "patterns.shared-window-anatomy",
        "patterns.left-brand-anchor",
        "patterns.primary-shell-global-primary-slot",
        "patterns.context-area",
        "patterns.right-action-and-window-area",
        "patterns.final-pane-leading-slot",
        "patterns.reusable-pattern-primary-navigation-shell",
        "patterns.pattern-a-two-pane-navigation-content",
        "patterns.reusable-pattern-secondary-page-hierarchy",
        "patterns.pattern-b-three-pane-navigation-list-detail",
        "patterns.pattern-c-navigation-tool-workspace",
        "patterns.pattern-d-optional-inspector",
        "patterns.primary-navigation",
        "patterns.secondary-pane",
        "patterns.main-content",
        "patterns.inspector",
        "patterns.surface-and-divider-behavior",
        "patterns.scrolling",
        "patterns.system-ui-boundary",
        "patterns.shell-selection-rule"
      ],
      "baselineSha256": "1f9aa5db712efd953f93c896c32cf5ced7aeabd3b92b51f3f348b0f79b447070",
      "baselineBytes": 26210
    },
    {
      "path": "references/interaction-spec.md",
      "policy": "generated-compatibility-aggregate",
      "parts": [
        "interaction.overview",
        "interaction.scope-and-source-levels",
        "interaction.official-platform-principles",
        "interaction.pointer-and-mouse",
        "interaction.keyboard-and-focus",
        "interaction.date-picker",
        "interaction.time-picker",
        "interaction.common-shortcuts",
        "interaction.navigation-and-selection",
        "interaction.window-and-resize-behavior",
        "interaction.overlay-selection",
        "interaction.forms-and-validation",
        "interaction.state-feedback",
        "interaction.undo-and-destructive-actions",
        "interaction.motion-sound-and-accessibility",
        "interaction.interactive-frontend-demonstration",
        "interaction.per-interaction-record",
        "interaction.interaction-qa-gate"
      ],
      "baselineSha256": "0c019113ceef82e2557ec3e0e518d4f7b66e5d803ba2e5cefe72a51674961cbf",
      "baselineBytes": 21085
    },
    {
      "path": "references/components/page-composition.md",
      "policy": "generated-compatibility-aggregate",
      "parts": [
        "composition.overview",
        "composition.content-recipes-decide-before-binding",
        "composition.executable-html-business-composites",
        "composition.plans",
        "composition.pattern-owned-navigation-shells",
        "composition.stroke-ownership"
      ],
      "baselineSha256": "f7370603361d201da67e27843f5b0da97ce2284380fb3f3a1bb235d183a95633",
      "baselineBytes": 13839
    },
    {
      "path": "references/page-blueprint-design.md",
      "policy": "generated-compatibility-aggregate",
      "parts": [
        "blueprint.overview",
        "blueprint.required-decisions",
        "blueprint.design-before-assembly",
        "blueprint.pattern-b-assembly-decisions",
        "blueprint.minimal-shape"
      ],
      "baselineSha256": "077311e7da77d04c3cca26512c27302aaaabf18e257bb7808f5e0e2592cf4309",
      "baselineBytes": 4552
    },
    {
      "path": "references/page-design-guidance.md",
      "policy": "generated-compatibility-aggregate",
      "parts": [
        "design.overview",
        "design.start-with-the-task-not-the-inventory",
        "design.design-at-the-real-content-width",
        "design.visual-alignment-and-grouping",
        "design.reuse-controls-design-missing-business-composites",
        "design.one-deliberate-first-preview"
      ],
      "baselineSha256": "400a6c9db73b12d5f426bbc39b88e9dacbde224ff703cfbe1149635b17dd3875",
      "baselineBytes": 4136
    },
    {
      "path": "references/component-specs-extended.md",
      "policy": "generated-compatibility-aggregate",
      "parts": [
        "supplement.overview",
        "supplement.universal-contract",
        "supplement.navigation-and-disclosure",
        "supplement.overlays-and-commands",
        "supplement.form-composition",
        "supplement.loading-data-and-dates",
        "supplement.specialized-content-and-layout"
      ],
      "baselineSha256": "a4f77749fb20832896ac483372f3683339e94bba940ac178fe96664fe8679a5d",
      "baselineBytes": 14448
    },
    {
      "path": "references/components/titlebar-segments.md",
      "policy": "generated-compatibility-aggregate",
      "parts": [
        "titlebar.overview",
        "titlebar.scenarios",
        "titlebar.title-typography",
        "titlebar.trailing-inset",
        "titlebar.executable-html-slots",
        "titlebar.generated-titlebar-scene"
      ],
      "baselineSha256": "2c19061b781307de78fb71b71e5a34bbf55ff07a056c518d521b0780754509b2",
      "baselineBytes": 10972
    },
    {
      "path": "references/components/local-component-delivery.md",
      "policy": "generated-compatibility-aggregate",
      "parts": [
        "delivery.overview",
        "delivery.reading",
        "delivery.project-output",
        "delivery.prepare",
        "delivery.styles",
        "delivery.calling"
      ],
      "baselineSha256": "4868a10e8c01443ba6b674c7b84ef520c88f4f3cc9d38521bc462387d00521c6",
      "baselineBytes": 5628
    }
  ],
  "resources": [
    {
      "id": "requirements.overview",
      "path": "references/resources/requirements/overview.md",
      "purpose": "Adaptive Requirement Specification",
      "stage": [],
      "appliesTo": {},
      "requires": [],
      "source": {
        "aggregate": "references/requirement-spec.md",
        "ordinal": 0,
        "linkBase": "references"
      },
      "readPolicy": "explicit-query"
    },
    {
      "id": "requirements.contents",
      "path": "references/resources/requirements/contents.md",
      "purpose": "Contents",
      "stage": [],
      "appliesTo": {},
      "requires": [],
      "source": {
        "aggregate": "references/requirement-spec.md",
        "ordinal": 1,
        "linkBase": "references"
      },
      "readPolicy": "explicit-query"
    },
    {
      "id": "requirements.intake-principle",
      "path": "references/resources/requirements/intake-principle.md",
      "purpose": "1. Intake Principle",
      "stage": [
        "intake"
      ],
      "appliesTo": {},
      "requires": [],
      "source": {
        "aggregate": "references/requirement-spec.md",
        "ordinal": 2,
        "linkBase": "references"
      },
      "readPolicy": "stage"
    },
    {
      "id": "requirements.three-decision-layers",
      "path": "references/resources/requirements/three-decision-layers.md",
      "purpose": "2. Three Decision Layers",
      "stage": [
        "intake"
      ],
      "appliesTo": {},
      "requires": [],
      "source": {
        "aggregate": "references/requirement-spec.md",
        "ordinal": 3,
        "linkBase": "references"
      },
      "readPolicy": "stage"
    },
    {
      "id": "requirements.adaptive-question-policy",
      "path": "references/resources/requirements/adaptive-question-policy.md",
      "purpose": "3. Adaptive Question Policy",
      "stage": [
        "intake"
      ],
      "appliesTo": {},
      "requires": [],
      "source": {
        "aggregate": "references/requirement-spec.md",
        "ordinal": 4,
        "linkBase": "references"
      },
      "readPolicy": "stage"
    },
    {
      "id": "requirements.user-input-guidance",
      "path": "references/resources/requirements/user-input-guidance.md",
      "purpose": "4. User Input Guidance",
      "stage": [
        "intake"
      ],
      "appliesTo": {},
      "requires": [],
      "source": {
        "aggregate": "references/requirement-spec.md",
        "ordinal": 5,
        "linkBase": "references"
      },
      "readPolicy": "stage"
    },
    {
      "id": "requirements.first-preview-planning",
      "path": "references/resources/requirements/first-preview-planning.md",
      "purpose": "5. First preview planning",
      "stage": [],
      "appliesTo": {},
      "requires": [],
      "source": {
        "aggregate": "references/requirement-spec.md",
        "ordinal": 6,
        "linkBase": "references"
      },
      "readPolicy": "explicit-query"
    },
    {
      "id": "requirements.generated-requirement-contract",
      "path": "references/resources/requirements/generated-requirement-contract.md",
      "purpose": "6. Generated Requirement Contract",
      "stage": [],
      "appliesTo": {},
      "requires": [],
      "source": {